{
  "manifest_version": 1,
  "game_id": "example.fixture",
  "title": "Synthetic package fixture (not playable)",
  "release_id": "release-001",
  "version": "0.1.0",
  "runtime": "1",
  "sdk": "0.1.0",
  "players": {
    "min": 1,
    "max": 4
  },
  "artifacts": [
    {
      "os": "windows",
      "architecture": "x86_64",
      "renderer": "gl_compatibility",
      "file": "fixture-windows-x86_64.pck",
      "size_bytes": 62,
      "sha256": "19fddf39fa031a3ff304a8eee71df5aee64a6a03fca3bec7074a7ae0b4c51010"
    },
    {
      "os": "macos",
      "architecture": "x86_64",
      "renderer": "gl_compatibility",
      "file": "fixture-macos-x86_64.pck",
      "size_bytes": 62,
      "sha256": "19fddf39fa031a3ff304a8eee71df5aee64a6a03fca3bec7074a7ae0b4c51010"
    },
    {
      "os": "macos",
      "architecture": "aarch64",
      "renderer": "gl_compatibility",
      "file": "fixture-macos-aarch64.pck",
      "size_bytes": 62,
      "sha256": "19fddf39fa031a3ff304a8eee71df5aee64a6a03fca3bec7074a7ae0b4c51010"
    }
  ]
}
